{
  "id": "mission.fixture.repo-audit-streamlinear",
  "mission_runs": [
    {
      "id": "mission.repo_audit.streamlinear",
      "mission_type": "repo_audit",
      "created_at": "2026-05-04T18:00:00Z",
      "created_by_ref": "agent.coordinator",
      "status": "completed",
      "summary": "Deterministic repo-audit mission for Streamlinear.",
      "objective": "Audit a repository for security, architecture, dependency, and quality risks while preserving evidence and governed state effects.",
      "source_refs": [
        "github:repo:example/streamlinear",
        "workgraph:repo:streamlinear:task:audit-linear-mcp",
        "speedrift:repo:streamlinear:review:security-audit-2026-05-04"
      ],
      "trigger_refs": [
        "trigger.repo-audit.streamlinear"
      ],
      "root_state_refs": [
        "state.repo.streamlinear.project",
        "state.repo.streamlinear.capability.linear-mcp-bridge",
        "state.repo.streamlinear.obligation.security-review",
        "state.repo.streamlinear.operating_picture.delivery",
        "state.agent.security-reviewer"
      ],
      "context_package_refs": [
        "context.mission.repo-audit.coordinator",
        "context.mission.repo-audit.security",
        "context.mission.repo-audit.architecture",
        "context.mission.repo-audit.dependencies",
        "context.mission.repo-audit.quality"
      ],
      "coordinator_agent_run_ref": "agent_run.repo_audit.coordinator",
      "agent_run_refs": [
        "agent_run.repo_audit.coordinator",
        "agent_run.repo_audit.project_explorer",
        "agent_run.repo_audit.security",
        "agent_run.repo_audit.architecture",
        "agent_run.repo_audit.dependencies",
        "agent_run.repo_audit.quality"
      ],
      "event_refs": [
        "mission_event.repo_audit.created",
        "mission_event.repo_audit.security.assigned",
        "mission_event.repo_audit.security.file_read",
        "mission_event.repo_audit.security.finding",
        "mission_event.repo_audit.dependencies.finding",
        "mission_event.repo_audit.quality.stumble",
        "mission_event.repo_audit.governance.blocked",
        "mission_event.repo_audit.commit",
        "mission_event.repo_audit.completed"
      ],
      "finding_refs": [
        "mission_finding.streamlinear.security-token-scope",
        "mission_finding.streamlinear.missing-dependency-evidence"
      ],
      "stumble_refs": [
        "mission_stumble.streamlinear.quality-overreach"
      ],
      "artifact_refs": [
        "mission_artifact.streamlinear.security-report",
        "mission_artifact.streamlinear.commit-result"
      ],
      "governance_receipt_refs": [
        "mission_governance.streamlinear.external-advisory-blocked"
      ],
      "review_signal_refs": [
        "review.mission.streamlinear.follow-up"
      ],
      "freshness": {
        "watermark_refs": [
          "github:repo:example/streamlinear@2026-05-04T18:00:00Z"
        ],
        "valid_until": "2026-05-05T18:00:00Z",
        "requires_refresh_before_external_action": true
      }
    }
  ],
  "agent_runs": [
    {
      "id": "agent_run.repo_audit.coordinator",
      "mission_run_id": "mission.repo_audit.streamlinear",
      "agent_ref": "agent.coordinator",
      "persona_ref": "persona.coordinator",
      "role": "coordinator",
      "responsibility": "Coordinate audit routing, preserve governance boundaries, and summarize mission results.",
      "status": "complete",
      "model_ref": "fixture-model",
      "started_at": "2026-05-04T18:00:00Z",
      "completed_at": "2026-05-04T18:30:00Z",
      "context_package_refs": [
        "context.mission.repo-audit.coordinator"
      ],
      "review_packet_refs": [
        "review_packet.mission.streamlinear.project-update"
      ],
      "event_refs": [
        "mission_event.repo_audit.created",
        "mission_event.repo_audit.completed"
      ],
      "observation_refs": [],
      "finding_refs": [],
      "stumble_refs": [],
      "artifact_refs": [],
      "memory_entry_refs": [],
      "token_usage": {
        "input": 1200,
        "output": 450
      },
      "cost": {
        "usd": 0.04
      }
    },
    {
      "id": "agent_run.repo_audit.project_explorer",
      "mission_run_id": "mission.repo_audit.streamlinear",
      "agent_ref": "agent.project-explorer",
      "persona_ref": "persona.project-explorer",
      "role": "project_explorer",
      "responsibility": "Identify repo layout, source refs, and audit scope.",
      "status": "complete",
      "model_ref": "fixture-model",
      "started_at": "2026-05-04T18:02:00Z",
      "completed_at": "2026-05-04T18:10:00Z",
      "context_package_refs": [
        "context.mission.repo-audit.project-explorer"
      ],
      "review_packet_refs": [],
      "event_refs": [],
      "observation_refs": [
        "mission_observation.streamlinear.repo-layout"
      ],
      "finding_refs": [],
      "stumble_refs": [],
      "artifact_refs": [],
      "memory_entry_refs": [],
      "token_usage": {
        "input": 900,
        "output": 300
      },
      "cost": {
        "usd": 0.03
      }
    },
    {
      "id": "agent_run.repo_audit.security",
      "mission_run_id": "mission.repo_audit.streamlinear",
      "agent_ref": "agent.security-reviewer",
      "persona_ref": "persona.security-reviewer",
      "role": "specialist_reviewer",
      "responsibility": "Inspect authentication and token handling risks.",
      "status": "complete",
      "model_ref": "fixture-model",
      "started_at": "2026-05-04T18:04:00Z",
      "completed_at": "2026-05-04T18:20:00Z",
      "context_package_refs": [
        "context.mission.repo-audit.security"
      ],
      "review_packet_refs": [
        "review_packet.mission.streamlinear.security"
      ],
      "event_refs": [
        "mission_event.repo_audit.security.assigned",
        "mission_event.repo_audit.security.file_read",
        "mission_event.repo_audit.security.finding"
      ],
      "observation_refs": [],
      "finding_refs": [
        "mission_finding.streamlinear.security-token-scope"
      ],
      "stumble_refs": [],
      "artifact_refs": [
        "mission_artifact.streamlinear.security-report"
      ],
      "memory_entry_refs": [],
      "token_usage": {
        "input": 1500,
        "output": 520
      },
      "cost": {
        "usd": 0.05
      }
    },
    {
      "id": "agent_run.repo_audit.architecture",
      "mission_run_id": "mission.repo_audit.streamlinear",
      "agent_ref": "agent.architecture-reviewer",
      "persona_ref": "persona.architecture-reviewer",
      "role": "specialist_reviewer",
      "responsibility": "Inspect boundary clarity and integration shape.",
      "status": "complete",
      "model_ref": "fixture-model",
      "started_at": "2026-05-04T18:04:00Z",
      "completed_at": "2026-05-04T18:18:00Z",
      "context_package_refs": [
        "context.mission.repo-audit.architecture"
      ],
      "review_packet_refs": [],
      "event_refs": [],
      "observation_refs": [],
      "finding_refs": [],
      "stumble_refs": [],
      "artifact_refs": [],
      "memory_entry_refs": [],
      "token_usage": {
        "input": 1100,
        "output": 410
      },
      "cost": {
        "usd": 0.04
      }
    },
    {
      "id": "agent_run.repo_audit.dependencies",
      "mission_run_id": "mission.repo_audit.streamlinear",
      "agent_ref": "agent.dependency-reviewer",
      "persona_ref": "persona.dependency-reviewer",
      "role": "specialist_reviewer",
      "responsibility": "Inspect dependency evidence and freshness.",
      "status": "complete",
      "model_ref": "fixture-model",
      "started_at": "2026-05-04T18:04:00Z",
      "completed_at": "2026-05-04T18:19:00Z",
      "context_package_refs": [
        "context.mission.repo-audit.dependencies"
      ],
      "review_packet_refs": [],
      "event_refs": [
        "mission_event.repo_audit.dependencies.finding"
      ],
      "observation_refs": [],
      "finding_refs": [
        "mission_finding.streamlinear.missing-dependency-evidence"
      ],
      "stumble_refs": [],
      "artifact_refs": [],
      "memory_entry_refs": [],
      "token_usage": {
        "input": 1000,
        "output": 360
      },
      "cost": {
        "usd": 0.04
      }
    },
    {
      "id": "agent_run.repo_audit.quality",
      "mission_run_id": "mission.repo_audit.streamlinear",
      "agent_ref": "agent.quality-reviewer",
      "persona_ref": "persona.quality-reviewer",
      "role": "specialist_reviewer",
      "responsibility": "Inspect test and quality signals while recording stumbles.",
      "status": "complete",
      "model_ref": "fixture-model",
      "started_at": "2026-05-04T18:04:00Z",
      "completed_at": "2026-05-04T18:21:00Z",
      "context_package_refs": [
        "context.mission.repo-audit.quality"
      ],
      "review_packet_refs": [],
      "event_refs": [
        "mission_event.repo_audit.quality.stumble"
      ],
      "observation_refs": [],
      "finding_refs": [],
      "stumble_refs": [
        "mission_stumble.streamlinear.quality-overreach"
      ],
      "artifact_refs": [],
      "memory_entry_refs": [
        "memory.mission.streamlinear.quality-overreach"
      ],
      "token_usage": {
        "input": 950,
        "output": 380
      },
      "cost": {
        "usd": 0.03
      }
    }
  ],
  "events": [
    {
      "id": "mission_event.repo_audit.created",
      "mission_run_id": "mission.repo_audit.streamlinear",
      "agent_run_id": "agent_run.repo_audit.coordinator",
      "created_at": "2026-05-04T18:00:00Z",
      "event_type": "mission_created",
      "summary": "Repo audit mission created from Workgraph request.",
      "source_refs": [
        "workgraph:repo:streamlinear:task:audit-linear-mcp"
      ],
      "evidence_refs": [
        "github:repo:example/streamlinear"
      ],
      "artifact_refs": []
    },
    {
      "id": "mission_event.repo_audit.security.assigned",